[
  {
    "slug": "sustainable-living-eco-friendly-home-features-1",
    "href": "https://indexecoresort.com/blog-details/sustainable-living-eco-friendly-home-features-1",
    "title": "Sustainable living: eco-friendly home features",
    "titleRenderedOnPage": false,
    "image": {
      "src": "https://indexecoresort.com/public/storage/images/admin/blogs/FBi0z6qzivdjaJUkmfJpC2jHoX6KQGKAJlQqQ9vn.jpg",
      "alt": "হোটেল লবি"
    },
    "categoryTag": "Investment",
    "meta": [
      "11 May 2026",
      "04:57 PM",
      "No Comments",
      "৫ মিনিট পড়ুন"
    ],
    "html": "<div>\n                            <h2><strong>আপনার হোটেল শেয়ার বিনিয়োগ কতটা লেজনক? সম্পূর্ণ গাইডলাইন (বাংলাদেশ প্রেক্ষাপেট)</strong></h2><p>হোটেল শেয়ার বিনিয়োগ—শুনতে যতটা গ্ল্যামারাস, বাস্তবে বিষয়টা তার চেয়েও বেশি কৌশল, পরিকল্পনা আর সঠিক সিদ্ধান্তের ব্যাপার। বাংলাদেশে হোটেল শিল্প ক্রমশ বিকশিত হচ্ছে এবং বিনিয়োগকারীদের জন্য এটি একটি আকর্ষণীয় সুযোগ হয়ে উঠছে।</p><p><strong>সঠিক হোটেলে বিনিয়োগ করলে বার্ষিক ১২–১৮% রিটার্ন পাওয়া সম্ভব—যা অন্য যেকোনো প্যাসিভ ইনকাম স্কিমের চেয়ে অনেক বেশি লাভজনক।</strong></p><h2><strong>হোটেল শেয়ার বিনিয়োগ কী?</strong></h2><p>হোটেল শেয়ার বিনিয়োগ হলো একটি হোটেল বা রিসোর্টের একটি নির্দিষ্ট অংশ কিনে সেই হোটেলের আয়ের একটি অংশ পাওয়ার ব্যবস্থা। এটি মূলত রিয়েল এস্টেট বিনিয়োগের একটি বিশেষ ধরন যেখানে আপনি সরাসরি সম্পদের মালিক হন।</p><h2><strong>বাংলাদেশে সুযোগ কোথায়?</strong></h2><p>কুয়াকাটা, কক্সবাজার এবং সিলেটের মতো পর্যটন এলাকায় হোটেল বিনিয়োগের সুযোগ দ্রুত বাড়ছে। বিশেষত কুয়াকাটায় পর্যটকের সংখ্যা গত পাঁচ বছরে তিনগুণ বেড়েছে।</p><p><strong>গুরুত্বপূর্ণ তথ্য</strong></p><p>&nbsp;</p><ul><li>৫-তারকা হোটেলে গড় অকুপেন্সি রেট ৭০–৮৫%</li><li>বার্ষিক রিটার্ন সাধারণত ১০–১৮% এর মধ্যে থাকে</li><li>বিনিয়োগ পুনরুদ্ধারের সময়কাল ৫–৮ বছর</li><li>মূলধন বৃদ্ধির হার বার্ষিক ৮–১২%</li></ul><h2><strong>বিনিয়োগের সুবিধাসমূহ</strong></h2><h3><strong>১. নিয়মিত প্যাসিভ ইনকাম</strong></h3><p>হোটেল চালু থাকলে প্রতি মাসে আপনার শেয়ার অনুযায়ী নির্দিষ্ট পরিমাণ আয় আসে। এটি সম্পূর্ণ প্যাসিভ কারণ হোটেল ম্যানেজমেন্ট টিম সব কিছু পরিচালনা করে।</p><h3><strong>২. মূলধন বৃদ্ধি</strong></h3><p>পর্যটন এলাকায় জমি ও সম্পদের মূল্য ক্রমাগত বাড়ছে। তাই আপনার বিনিয়োগের মূল মূল্যও সময়ের সাথে বাড়তে থাকবে।</p><h3><strong>৩. পেশাদার ব্যবস্থাপনা</strong></h3><p>আপনাকে হোটেল চালানোর চিন্তা করতে হবে না। বিশেষজ্ঞ ম্যানেজমেন্ট টিম সব কিছু পরিচালনা করে থাকে।</p><p><strong>হোটেল বিনিয়োগপ্যাসিভ ইনকামরিয়েল এস্টেটকুয়াকাটা৫ তারকা হোটেলবাংলাদেশ</strong></p>\n                        </div>\n                        <div class=\"blog-details-share-row\">\n                            <span class=\"blog-details-share-label\">শেয়ার করুন:</span>\n\n                            <!-- Facebook -->\n                            <a href=\"#\" target=\"_blank\" class=\"blog-details-share-btn blog-details-share-btn--fb\" title=\"Facebook\">\n                                <svg xmlns=\"http://www.w3.org/2000/svg\" width=\"18\" height=\"18\" fill=\"currentColor\" viewBox=\"0 0 24 24\">\n                                    <path d=\"M22 12.07C22 6.48 17.52 2 12 2S2 6.48 2 12.07c0 5.02 3.66 9.18 8.44 9.93v-7.03H7.9v-2.9h2.54V9.41c0-2.5 1.5-3.89 3.78-3.89 1.1 0 2.25.2 2.25.2v2.48h-1.27c-1.25 0-1.64.78-1.64 1.57v1.88h2.8l-.45 2.9h-2.35V22c4.78-.75 8.44-4.91 8.44-9.93z\"></path>\n                                </svg>\n                            </a>\n\n                            <!-- Twitter (X) -->\n                            <a href=\"#\" target=\"_blank\" class=\"blog-details-share-btn blog-details-share-btn--tw\" title=\"Twitter\">\n                                <svg xmlns=\"http://www.w3.org/2000/svg\" width=\"18\" height=\"18\" fill=\"currentColor\" viewBox=\"0 0 24 24\">\n                                    <path d=\"M18.244 2H21l-6.54 7.47L22 22h-6.828l-5.348-6.99L3.5 22H1l7.02-8.02L2 2h6.828l4.866 6.36L18.244 2zM17.2 20h1.9L7.8 4H5.9L17.2 20z\"></path>\n                                </svg>\n                            </a>\n\n                            <!-- WhatsApp -->\n                            <a href=\"#\" target=\"_blank\" class=\"blog-details-share-btn blog-details-share-btn--wa\" title=\"WhatsApp\">\n                                <svg xmlns=\"http://www.w3.org/2000/svg\" width=\"18\" height=\"18\" fill=\"currentColor\" viewBox=\"0 0 24 24\">\n                                    <path d=\"M20.52 3.48A11.86 11.86 0 0012.01 0C5.38 0 0 5.38 0 12c0 2.12.55 4.19 1.6 6.03L0 24l6.17-1.6A11.94 11.94 0 0012 24c6.62 0 12-5.38 12-12 0-3.2-1.25-6.2-3.48-8.52zM12 21.82c-1.87 0-3.7-.5-5.3-1.44l-.38-.22-3.66.95.98-3.56-.25-.37A9.77 9.77 0 012.18 12c0-5.41 4.41-9.82 9.82-9.82 2.62 0 5.08 1.02 6.94 2.88A9.75 9.75 0 0121.82 12c0 5.41-4.41 9.82-9.82 9.82zm5.46-7.37c-.3-.15-1.78-.88-2.06-.98-.27-.1-.47-.15-.67.15-.2.3-.77.98-.94 1.18-.17.2-.35.22-.65.07-.3-.15-1.26-.46-2.4-1.46-.89-.79-1.49-1.76-1.66-2.06-.17-.3-.02-.46.13-.61.14-.14.3-.35.45-.52.15-.17.2-.3.3-.5.1-.2.05-.37-.02-.52-.07-.15-.67-1.62-.92-2.22-.24-.58-.49-.5-.67-.51h-.57c-.2 0-.52.07-.8.37s-1.05 1.02-1.05 2.5 1.08 2.9 1.23 3.1c.15.2 2.13 3.26 5.16 4.57.72.31 1.28.5 1.72.64.72.23 1.37.2 1.88.12.57-.08 1.78-.73 2.03-1.44.25-.7.25-1.3.17-1.44-.07-.15-.27-.22-.57-.37z\"></path>\n                                </svg>\n                            </a>\n\n                            <!-- LinkedIn -->\n                            <a href=\"#\" target=\"_blank\" class=\"blog-details-share-btn blog-details-share-btn--ln\" title=\"LinkedIn\">\n                                <svg xmlns=\"http://www.w3.org/2000/svg\" width=\"18\" height=\"18\" fill=\"currentColor\" viewBox=\"0 0 24 24\">\n                                    <path d=\"M4.98 3.5C4.98 5 3.87 6.1 2.49 6.1 1.11 6.1 0 5 0 3.5 0 2 1.11.9 2.49.9c1.38 0 2.49 1.1 2.49 2.6zM.24 8.4h4.5V24H.24V8.4zM8.04 8.4h4.31v2.13h.06c.6-1.13 2.07-2.32 4.26-2.32 4.55 0 5.39 2.99 5.39 6.88V24h-4.5v-7.86c0-1.87-.03-4.28-2.6-4.28-2.6 0-3 2.03-3 4.14V24h-4.5V8.4z\"></path>\n                                </svg>\n                            </a>\n                        </div>",
    "share": {
      "label": "শেয়ার করুন:",
      "links": [
        {
          "network": "fb",
          "href": "#"
        },
        {
          "network": "tw",
          "href": "#"
        },
        {
          "network": "wa",
          "href": "#"
        },
        {
          "network": "ln",
          "href": "#"
        }
      ]
    },
    "sidebar": {
      "recent": [
        {
          "num": "1",
          "title": "কুয়াকাটায় আধুনিক রিসোর্ট বিনিয়োগের নতুন সম্ভাবনা",
          "href": "https://indexecoresort.com/blog-details/kuzakataz-adhunik-risort-binizoger-ntun-smvabna-2"
        },
        {
          "num": "2",
          "title": "Sustainable living: eco-friendly home features",
          "href": "https://indexecoresort.com/blog-details/sustainable-living-eco-friendly-home-features-1"
        }
      ],
      "categories": [
        {
          "label": "Birthday Parties & Family Celebrations",
          "count": "1",
          "href": "https://indexecoresort.com/event"
        },
        {
          "label": "Corporate Events & Conferences",
          "count": "1",
          "href": "https://indexecoresort.com/event"
        },
        {
          "label": "Wedding & Reception",
          "count": "1",
          "href": "https://indexecoresort.com/event"
        },
        {
          "label": "2026 BUSINESS CONFERENCE",
          "count": "1",
          "href": "https://indexecoresort.com/event"
        }
      ],
      "cta": {
        "title": "বিনিয়োগে আগ্রহী?",
        "text": "আমাদের বিশেষজ্ঞ টিমের সাথে বিনামূল্যে পরামর্শ করুন এবং আপনার স্বপ্নের বিনিয়োগ শুরু করুন।",
        "link": {
          "label": "আজই যোগাযোগ করুন →",
          "href": null
        }
      }
    }
  },
  {
    "slug": "kuzakataz-adhunik-risort-binizoger-ntun-smvabna-2",
    "href": "https://indexecoresort.com/blog-details/kuzakataz-adhunik-risort-binizoger-ntun-smvabna-2",
    "title": "কুয়াকাটায় আধুনিক রিসোর্ট বিনিয়োগের নতুন সম্ভাবনা",
    "titleRenderedOnPage": false,
    "image": {
      "src": "https://indexecoresort.com/public/storage/images/admin/blogs/IU1okoiDJOu273Rcv0mLc9atqyFD0ipjCf7eQwAr.jpg",
      "alt": "হোটেল লবি"
    },
    "categoryTag": "Investment",
    "meta": [
      "11 May 2026",
      "05:41 PM",
      "No Comments",
      "৫ মিনিট পড়ুন"
    ],